{
  "$schema": "https://json-schema.org/draft/2020-12/schema",
  "$id": "https://github.com/shaug/compris/review-suite/evals/contracts/provenance.schema.json",
  "title": "Review replay case provenance",
  "description": "Where one case came from and under what authority it is retained. Provenance is private: it never enters an executor request.",
  "type": "object",
  "additionalProperties": false,
  "required": [
    "provenance_version",
    "case_id",
    "origin",
    "retention_authority",
    "sanitization",
    "recorded_at"
  ],
  "properties": {
    "provenance_version": {
      "const": "1.0"
    },
    "case_id": {
      "type": "string",
      "pattern": "^[a-z0-9]+(-[a-z0-9]+)*$"
    },
    "origin": {
      "enum": [
        "synthetic",
        "minimized_reproduction",
        "repository_history",
        "connector_outcome"
      ]
    },
    "retention_authority": {
      "type": "string",
      "minLength": 1
    },
    "sanitization": {
      "type": "string",
      "minLength": 1
    },
    "recorded_at": {
      "type": "string",
      "pattern": "^\\d{4}-\\d{2}-\\d{2}$"
    },
    "notes": {
      "type": "string",
      "minLength": 1
    },
    "adjudication": {
      "description": "How this case's materiality was adjudicated, and by whom. The requirement is two independent adjudications; this records what each one actually was so a reader never has to infer it. Absent on a case that predates the record.",
      "type": "object",
      "additionalProperties": false,
      "required": [
        "first",
        "second"
      ],
      "properties": {
        "first": {
          "description": "The first adjudication. Normally the recorded source disposition, which is strong for a root cause, thin for severity, and unavailable for formulations.",
          "type": "string",
          "minLength": 1
        },
        "second": {
          "description": "The second adjudication. `oracle` means a machine settled it: the stated requirement runs, fails against the candidate, and holds once the stated root cause is corrected. `owner_required` means no oracle exists and the owner must supply it - never a fresh agent context sharing a model family with the reviewer being measured, whose errors correlate with it. `owner_confirmed` means the owner has directly adjudicated the case; `owner_disposition` then records the outcome. `none` means neither, which no case may ship with once it is scored.",
          "enum": [
            "oracle",
            "owner_required",
            "owner_confirmed",
            "none"
          ]
        },
        "notes": {
          "type": "string",
          "minLength": 1
        },
        "owner_disposition": {
          "description": "Present only when `second` is `owner_confirmed`. A concise record of the owner's actual adjudication, distinct from the `notes` field's pre-adjudication recommendation: `outcome` is the owner's confirmed verdict on materiality, `reasoning` is a short summary in the owner's own terms rather than the recommender's framing, and `source` links to the full reasoning recorded in the tracker rather than duplicating it here.",
          "type": "object",
          "additionalProperties": false,
          "required": [
            "outcome",
            "reasoning",
            "source"
          ],
          "properties": {
            "outcome": {
              "enum": [
                "confirmed_material",
                "confirmed_clean"
              ]
            },
            "reasoning": {
              "type": "string",
              "minLength": 1
            },
            "source": {
              "type": "string",
              "minLength": 1
            }
          }
        }
      }
    }
  }
}
