{
  "provenance_version": "1.0",
  "case_id": "watcher-check-policy-duplication",
  "origin": "repository_history",
  "retention_authority": "This repository's own delivery history: commit 93516194388116f4841fc191a8c78c191d0da5b1, whose message records that the code-simplicity lens itself flagged the last remaining inline copy of the failed-check policy, and that the same duplication class had twice before produced self-contradictory watcher states. Public, owner-authored, no retention question.",
  "sanitization": "Rewritten from scratch against a fictional watch-tool subject rather than this suite's own PR-watching code. The first draft only lightly renamed the two function names while keeping every local variable name, every dict key, and the removed code comment verbatim from the real source; that draft was caught by review and replaced. A second review then found the rewritten diff had inverted the case's own polarity: it showed the real fix (removing the last inline duplicate) rather than a diff a reviewer should flag, so its own material root cause and expected verdict contradicted the diff it described. Rebuilt so the diff instead adds a new call site that duplicates the shared predicate's check inline, which is the failure shape the drift history in this commit's message actually warns against. Every function name, local variable, dict key, and comment is independently authored rather than derived from the source.",
  "recorded_at": "2026-07-27",
  "adjudication": {
    "first": "This repository's commit 93516194388116f4841fc191a8c78c191d0da5b1: the code-simplicity lens found and this commit resolved an inline duplicate of a shared policy, with a stated history of that duplication class causing real drift. This case models a new instance of the same duplication class the commit's own message warns against, rather than reproducing the commit's diff directly.",
    "second": "owner_confirmed",
    "notes": "No executable oracle exists for a local-complexity judgement like this. Recommended adjudication: MATERIAL. The packet states two other call sites already use the shared predicate and that this exact duplication class had already caused real drift twice, which are concrete, checkable facts rather than a stylistic preference for less code. Residual risk for the owner: the severity is recorded as strong_recommendation rather than blocking, since the packet shows no currently observed drift, only a stated history of it; a reviewer could reasonably argue for blocking severity given that history, and the owner should decide which is right.",
    "owner_disposition": {
      "outcome": "confirmed_material",
      "reasoning": "Owner confirmed material, consistent with the recommended disposition and with this repository's own commit history recording the drift this case demonstrates.",
      "source": "https://github.com/shaug/agent-scripts/issues/58#issuecomment-5099314609 (owner adjudication, 8 of 8); https://github.com/shaug/agent-scripts/issues/58#issuecomment-5099339357 (case 3/7 cross-reference resolution)"
    }
  }
}
