{
  "provenance_version": "1.0",
  "case_id": "record-status-transition-guard",
  "origin": "minimized_reproduction",
  "retention_authority": "Minimized from an adjudicated human review finding in the public repository shaug/atelier, pull request 277, review comment 2861848880, authored by the repository owner and accepted in the reply 2861868165, which names implementing commit 79703c5 and the added regression coverage. Public source, owner-authored review, no third-party or customer material.",
  "sanitization": "Rewritten from scratch against a fictional planner tool and a fictional tracker CLI. Retains only the shape of the adjudicated exchange: a two-step create-then-transition sequence gains a retry and a fail-closed auto-close so a newly created record can never be left unexpectedly runnable. The source's own product name, CLI name, and 'changeset'/'export' terminology were replaced with fictional equivalents ('task record', 'tracker', 'publish') rather than lightly renamed, because the originals are the real product's own identifiers. No source identifier, path, symbol, prose, or diff was copied. No business logic, domain identifier, customer context, credential, or hidden reasoning.",
  "recorded_at": "2026-07-27",
  "adjudication": {
    "first": "shaug/atelier PR 277 review comment 2861848880, accepted in reply 2861868165, which names implementing commit 79703c5 and the regression tests added for the fail-closed path.",
    "second": "owner_confirmed",
    "notes": "No executable oracle exists for whether added robustness machinery is over-engineered versus requirement-justified. Recommended adjudication: CLEAN / NOT MATERIAL to gate on. The packet states the created record is runnable by default and picked up within seconds, which makes a silent transition failure a real hazard rather than a hypothetical one, and the sibling script already carries the identical protection, which is evidence of an established pattern rather than one-off scaffolding. Residual risk for the owner to weigh: retry count and backoff are unspecified in the packet, so a reviewer could reasonably ask for that detail without the request being about over-engineering at all.",
    "owner_disposition": {
      "outcome": "confirmed_clean",
      "reasoning": "Owner confirmed: protecting against or recovering from an error case that falls within the scope of the stated requirements is good engineering, not over-engineering. Confirms the recommended CLEAN / NOT MATERIAL disposition.",
      "source": "https://github.com/shaug/compris/issues/58#issuecomment-5099314609 (owner adjudication, 8 of 8); https://github.com/shaug/compris/issues/58#issuecomment-5099339357 (case 3/7 cross-reference resolution)"
    }
  }
}
