{
  "provenance_version": "1.0",
  "case_id": "stale-claim-release-guard",
  "origin": "minimized_reproduction",
  "retention_authority": "Minimized from an adjudicated human review finding in the public repository shaug/atelier, pull request 373, review comment 2869270760, authored by the repository owner and accepted in the reply that added a regression test for the collect/apply window. Public source, owner-authored review, no third-party or customer material.",
  "sanitization": "Rewritten from scratch against a fictional claim queue. Retains only the failure shape: a collect-then-apply guard compares ownership only when the captured owner was present, so the unowned-at-capture interleaving bypasses it. No source identifier, path, symbol, prose, or diff was copied. No business logic, domain identifier, customer context, credential, or hidden reasoning.",
  "recorded_at": "2026-07-27",
  "notes": "Multi-file case: the interleaving is only reachable by reading the untouched claim writer. Second adjudication is available by oracle."
}
